{
  "meta": {
    "schema_version": "1.0",
    "opportunity_id": "OPP-2026-0498",
    "template_id": "devops/devops-standard",
    "source_agents": [
      "intake",
      "discovery",
      "architecture",
      "cost-estimate"
    ],
    "created_at": "2026-10-23T09:00:00Z",
    "generated_by": "sample-data"
  },
  "intake": {
    "customer_name": "Tailspin Toys",
    "industry": "Retail and manufacturing (toys, e-commerce)",
    "contacts": [
      {
        "name": "Daniel Weber",
        "role": "CTO (executive sponsor)",
        "email": "daniel.weber@tailspin-toys.example.com"
      },
      {
        "name": "Sophie Klein",
        "role": "IT Operations Lead",
        "email": "sophie.klein@tailspin-toys.example.com"
      },
      {
        "name": "Jonas Becker",
        "role": "Lead Developer, E-commerce",
        "email": "jonas.becker@tailspin-toys.example.com"
      }
    ],
    "engagement_type": "DevOps platform implementation",
    "template_hint": "devops/devops-standard",
    "problem_statement": "The e-commerce platform is released once a month in a 6-hour maintenance window with manual scripts, 2 to 3 releases per quarter fail, there is no central logging and MTTR is about 5 hours. Traffic peaks at 5x during the Christmas season.",
    "goals": [
      "Deploy each service at least weekly without a maintenance window",
      "Lead time for changes under 1 day",
      "Change failure rate under 10% and MTTR under 1 hour",
      "Prove 5x Christmas peak capacity with a load test before the code freeze"
    ],
    "timeline": "12 weeks",
    "budget_range": "EUR 150,000 (about USD 165,000) one-time",
    "constraints": [
      "GDPR: all data and logs stay in eu-central-1",
      "Live and load-tested before the 1 November 2027 code freeze",
      "3 .NET Framework 4.8 services stay on Windows EC2; only their pipelines move",
      "Tailspin's 4-person platform team must run the platform after handover"
    ]
  },
  "discovery": {
    "source": "discovery",
    "findings": [
      "9 .NET services (6 on .NET 8, 3 on .NET Framework 4.8), React storefront, SQL Server",
      "Azure DevOps Repos and one Jenkins server; deployments by manual PowerShell scripts",
      "No infrastructure as code; environments differ (config drift)",
      "Licences for GitHub Enterprise Cloud already purchased for 2027",
      "PagerDuty and Microsoft Teams are used for on-call and alerts"
    ],
    "requirements": [
      "Terraform modules for networking, EKS, ECR, IAM, observability and security",
      "Reusable GitHub Actions workflows with build, test, scan, deploy stages",
      "Canary deployments with automatic rollback on SLO breach",
      "Dashboards and alerts per service; runbooks for the top 10 incidents",
      "Load test at 5x peak (about 2,500 requests per second)"
    ],
    "stakeholders": [
      {
        "name": "Daniel Weber",
        "role": "CTO"
      },
      {
        "name": "Sophie Klein",
        "role": "IT Operations Lead"
      },
      {
        "name": "Jonas Becker",
        "role": "Lead Developer, E-commerce"
      }
    ],
    "transcript_refs": [],
    "notes": "The migration project moves SQL Server to Amazon RDS for SQL Server; this engagement does not."
  },
  "architecture": {
    "diagram_images": [],
    "services": [
      {
        "name": "Amazon EKS",
        "purpose": "Kubernetes clusters for the e-commerce services (non-prod and prod)"
      },
      {
        "name": "Karpenter",
        "purpose": "Node autoscaling for the 5x seasonal peak"
      },
      {
        "name": "Amazon ECR",
        "purpose": "Container image registry with scanning"
      },
      {
        "name": "GitHub Actions",
        "purpose": "CI/CD pipelines (GitHub Enterprise Cloud)"
      },
      {
        "name": "Terraform",
        "purpose": "Infrastructure as code for all environments"
      },
      {
        "name": "Argo Rollouts",
        "purpose": "Canary and blue/green deployments with automatic rollback"
      },
      {
        "name": "Amazon Managed Service for Prometheus",
        "purpose": "Metrics"
      },
      {
        "name": "Amazon Managed Grafana",
        "purpose": "Dashboards"
      },
      {
        "name": "Amazon CloudWatch",
        "purpose": "Container Insights, logs and alarms"
      },
      {
        "name": "Amazon Inspector",
        "purpose": "Container image and EC2 vulnerability scanning"
      },
      {
        "name": "AWS Security Hub",
        "purpose": "Security findings and standards"
      },
      {
        "name": "AWS Secrets Manager",
        "purpose": "Application secrets"
      },
      {
        "name": "Application Load Balancer",
        "purpose": "Ingress for the storefront and APIs"
      }
    ],
    "assumptions": [
      "The landing zone and VPCs in eu-central-1 are delivered by the migration project by week 2",
      "GitHub Enterprise Cloud organisation is available with SSO by week 1",
      "Tailspin developers are available to fix application issues found during containerisation"
    ],
    "nfrs": [
      "Handle 5x normal traffic (about 2,500 requests per second) with p95 latency under 400 ms",
      "Zero-downtime deployments",
      "99.9% availability for the storefront",
      "All data and logs in eu-central-1 (GDPR)"
    ]
  },
  "cost": {
    "currency": "USD",
    "monthly_total": 5800,
    "annual_total": 69600,
    "region": "eu-central-1",
    "line_items": [
      {
        "service": "Amazon EKS control plane (2 clusters)",
        "monthly": 146,
        "annual": 1752,
        "notes": "non-prod and prod"
      },
      {
        "service": "Amazon EC2 worker nodes (Karpenter)",
        "monthly": 3904,
        "annual": 46848,
        "notes": "Average incl. seasonal peak, Savings Plan"
      },
      {
        "service": "Amazon ECR",
        "monthly": 60,
        "annual": 720,
        "notes": "Images and scanning"
      },
      {
        "service": "Amazon Managed Service for Prometheus",
        "monthly": 350,
        "annual": 4200,
        "notes": ""
      },
      {
        "service": "Amazon Managed Grafana",
        "monthly": 90,
        "annual": 1080,
        "notes": "10 editor/viewer users"
      },
      {
        "service": "Amazon CloudWatch",
        "monthly": 420,
        "annual": 5040,
        "notes": "Container Insights, logs, alarms"
      },
      {
        "service": "Amazon Inspector",
        "monthly": 180,
        "annual": 2160,
        "notes": ""
      },
      {
        "service": "AWS Security Hub",
        "monthly": 120,
        "annual": 1440,
        "notes": ""
      },
      {
        "service": "Application Load Balancer",
        "monthly": 260,
        "annual": 3120,
        "notes": "2 ALBs"
      },
      {
        "service": "NAT gateways",
        "monthly": 270,
        "annual": 3240,
        "notes": "3 AZs, prod"
      }
    ],
    "assumptions": [
      "On-demand pricing in eu-central-1, October 2026, with a 1-year Compute Savings Plan for baseline nodes",
      "GitHub Enterprise Cloud licences are paid by Tailspin and not included"
    ],
    "source_link": "https://calculator.aws/#/estimate?id=sample-tailspin-platform",
    "source_file": null
  }
}
